{
  "month": "2018_04",
  "species": "humpback_song",
  "count": 21,
  "n_positive": 21,
  "n_negative": 0,
  "n_recordings": 6,
  "annotations": [
    {
      "species": "humpback_song",
      "recording_32khz": "MARS_20180423_235912_resampled_32kHz.wav",
      "annotation_offset_s": 350.0,
      "frame_index": 70,
      "recording_start_utc_epoch": 1524527952,
      "label": 1,
      "label_type": "positive",
      "annotator": "duane",
      "month": "2018_04"
    },
    {
      "species": "humpback_song",
      "recording_32khz": "MARS_20180424_050912_resampled_32kHz.wav",
      "annotation_offset_s": 420.0,
      "frame_index": 84,
      "recording_start_utc_epoch": 1524546552,
      "label": 1,
      "label_type": "positive",
      "annotator": "duane",
      "month": "2018_04"
    },
    {
      "species": "humpback_song",
      "recording_32khz": "MARS_20180430_061912_resampled_32kHz.wav",
      "annotation_offset_s": 190.0,
      "frame_index": 38,
      "recording_start_utc_epoch": 1525069152,
      "label": 1,
      "label_type": "positive",
      "annotator": "duane",
      "month": "2018_04"
    },
    {
      "species": "humpback_song",
      "recording_32khz": "MARS_20180430_121912_resampled_32kHz.wav",
      "annotation_offset_s": 10.0,
      "frame_index": 2,
      "recording_start_utc_epoch": 1525090752,
      "label": 1,
      "label_type": "positive",
      "annotator": "duane",
      "month": "2018_04"
    },
    {
      "species": "humpback_song",
      "recording_32khz": "MARS_20180430_121912_resampled_32kHz.wav",
      "annotation_offset_s": 140.0,
      "frame_index": 28,
      "recording_start_utc_epoch": 1525090752,
      "label": 1,
      "label_type": "positive",
      "annotator": "duane",
      "month": "2018_04"
    },
    {
      "species": "humpback_song",
      "recording_32khz": "MARS_20180430_122912_resampled_32kHz.wav",
      "annotation_offset_s": 275.0,
      "frame_index": 55,
      "recording_start_utc_epoch": 1525091352,
      "label": 1,
      "label_type": "positive",
      "annotator": "duane",
      "month": "2018_04"
    },
    {
      "species": "humpback_song",
      "recording_32khz": "MARS_20180430_122912_resampled_32kHz.wav",
      "annotation_offset_s": 525.0,
      "frame_index": 105,
      "recording_start_utc_epoch": 1525091352,
      "label": 1,
      "label_type": "positive",
      "annotator": "duane",
      "month": "2018_04"
    },
    {
      "species": "humpback_song",
      "recording_32khz": "MARS_20180430_122912_resampled_32kHz.wav",
      "annotation_offset_s": 255.0,
      "frame_index": 51,
      "recording_start_utc_epoch": 1525091352,
      "label": 1,
      "label_type": "positive",
      "annotator": "duane",
      "month": "2018_04"
    },
    {
      "species": "humpback_song",
      "recording_32khz": "MARS_20180430_122912_resampled_32kHz.wav",
      "annotation_offset_s": 350.0,
      "frame_index": 70,
      "recording_start_utc_epoch": 1525091352,
      "label": 1,
      "label_type": "positive",
      "annotator": "duane",
      "month": "2018_04"
    },
    {
      "species": "humpback_song",
      "recording_32khz": "MARS_20180430_123912_resampled_32kHz.wav",
      "annotation_offset_s": 15.0,
      "frame_index": 3,
      "recording_start_utc_epoch": 1525091952,
      "label": 1,
      "label_type": "positive",
      "annotator": "duane",
      "month": "2018_04"
    },
    {
      "species": "humpback_song",
      "recording_32khz": "MARS_20180430_123912_resampled_32kHz.wav",
      "annotation_offset_s": 60.0,
      "frame_index": 12,
      "recording_start_utc_epoch": 1525091952,
      "label": 1,
      "label_type": "positive",
      "annotator": "duane",
      "month": "2018_04"
    },
    {
      "species": "humpback_song",
      "recording_32khz": "MARS_20180430_123912_resampled_32kHz.wav",
      "annotation_offset_s": 80.0,
      "frame_index": 16,
      "recording_start_utc_epoch": 1525091952,
      "label": 1,
      "label_type": "positive",
      "annotator": "duane",
      "month": "2018_04"
    },
    {
      "species": "humpback_song",
      "recording_32khz": "MARS_20180430_123912_resampled_32kHz.wav",
      "annotation_offset_s": 65.0,
      "frame_index": 13,
      "recording_start_utc_epoch": 1525091952,
      "label": 1,
      "label_type": "positive",
      "annotator": "duane",
      "month": "2018_04"
    },
    {
      "species": "humpback_song",
      "recording_32khz": "MARS_20180430_123912_resampled_32kHz.wav",
      "annotation_offset_s": 155.0,
      "frame_index": 31,
      "recording_start_utc_epoch": 1525091952,
      "label": 1,
      "label_type": "positive",
      "annotator": "duane",
      "month": "2018_04"
    },
    {
      "species": "humpback_song",
      "recording_32khz": "MARS_20180430_123912_resampled_32kHz.wav",
      "annotation_offset_s": 195.0,
      "frame_index": 39,
      "recording_start_utc_epoch": 1525091952,
      "label": 1,
      "label_type": "positive",
      "annotator": "duane",
      "month": "2018_04"
    },
    {
      "species": "humpback_song",
      "recording_32khz": "MARS_20180430_123912_resampled_32kHz.wav",
      "annotation_offset_s": 35.0,
      "frame_index": 7,
      "recording_start_utc_epoch": 1525091952,
      "label": 1,
      "label_type": "positive",
      "annotator": "duane",
      "month": "2018_04"
    },
    {
      "species": "humpback_song",
      "recording_32khz": "MARS_20180430_123912_resampled_32kHz.wav",
      "annotation_offset_s": 75.0,
      "frame_index": 15,
      "recording_start_utc_epoch": 1525091952,
      "label": 1,
      "label_type": "positive",
      "annotator": "duane",
      "month": "2018_04"
    },
    {
      "species": "humpback_song",
      "recording_32khz": "MARS_20180430_123912_resampled_32kHz.wav",
      "annotation_offset_s": 95.0,
      "frame_index": 19,
      "recording_start_utc_epoch": 1525091952,
      "label": 1,
      "label_type": "positive",
      "annotator": "duane",
      "month": "2018_04"
    },
    {
      "species": "humpback_song",
      "recording_32khz": "MARS_20180430_123912_resampled_32kHz.wav",
      "annotation_offset_s": 115.0,
      "frame_index": 23,
      "recording_start_utc_epoch": 1525091952,
      "label": 1,
      "label_type": "positive",
      "annotator": "duane",
      "month": "2018_04"
    },
    {
      "species": "humpback_song",
      "recording_32khz": "MARS_20180430_123912_resampled_32kHz.wav",
      "annotation_offset_s": 135.0,
      "frame_index": 27,
      "recording_start_utc_epoch": 1525091952,
      "label": 1,
      "label_type": "positive",
      "annotator": "duane",
      "month": "2018_04"
    },
    {
      "species": "humpback_song",
      "recording_32khz": "MARS_20180430_123912_resampled_32kHz.wav",
      "annotation_offset_s": 175.0,
      "frame_index": 35,
      "recording_start_utc_epoch": 1525091952,
      "label": 1,
      "label_type": "positive",
      "annotator": "duane",
      "month": "2018_04"
    }
  ]
}
