{
  "month": "2026_04",
  "species": "other",
  "count": 27,
  "n_positive": 27,
  "n_negative": 0,
  "n_recordings": 27,
  "annotations": [
    {
      "species": "other",
      "recording_32khz": "MARS_20260401_011000_resampled_32kHz.wav",
      "annotation_offset_s": 545.0,
      "frame_index": 109,
      "recording_start_utc_epoch": 1775005800,
      "label": 1,
      "label_type": "positive",
      "annotator": "duane",
      "month": "2026_04"
    },
    {
      "species": "other",
      "recording_32khz": "MARS_20260403_023000_resampled_32kHz.wav",
      "annotation_offset_s": 330.0,
      "frame_index": 66,
      "recording_start_utc_epoch": 1775183400,
      "label": 1,
      "label_type": "positive",
      "annotator": "duane",
      "month": "2026_04"
    },
    {
      "species": "other",
      "recording_32khz": "MARS_20260403_110000_resampled_32kHz.wav",
      "annotation_offset_s": 510.0,
      "frame_index": 102,
      "recording_start_utc_epoch": 1775214000,
      "label": 1,
      "label_type": "positive",
      "annotator": "duane",
      "month": "2026_04"
    },
    {
      "species": "other",
      "recording_32khz": "MARS_20260404_100000_resampled_32kHz.wav",
      "annotation_offset_s": 5.0,
      "frame_index": 1,
      "recording_start_utc_epoch": 1775296800,
      "label": 1,
      "label_type": "positive",
      "annotator": "duane",
      "month": "2026_04"
    },
    {
      "species": "other",
      "recording_32khz": "MARS_20260411_103000_resampled_32kHz.wav",
      "annotation_offset_s": 70.0,
      "frame_index": 14,
      "recording_start_utc_epoch": 1775903400,
      "label": 1,
      "label_type": "positive",
      "annotator": "duane",
      "month": "2026_04"
    },
    {
      "species": "other",
      "recording_32khz": "MARS_20260411_225000_resampled_32kHz.wav",
      "annotation_offset_s": 175.0,
      "frame_index": 35,
      "recording_start_utc_epoch": 1775947800,
      "label": 1,
      "label_type": "positive",
      "annotator": "duane",
      "month": "2026_04"
    },
    {
      "species": "other",
      "recording_32khz": "MARS_20260412_052000_resampled_32kHz.wav",
      "annotation_offset_s": 560.0,
      "frame_index": 112,
      "recording_start_utc_epoch": 1775971200,
      "label": 1,
      "label_type": "positive",
      "annotator": "duane",
      "month": "2026_04"
    },
    {
      "species": "other",
      "recording_32khz": "MARS_20260412_095000_resampled_32kHz.wav",
      "annotation_offset_s": 370.0,
      "frame_index": 74,
      "recording_start_utc_epoch": 1775987400,
      "label": 1,
      "label_type": "positive",
      "annotator": "duane",
      "month": "2026_04"
    },
    {
      "species": "other",
      "recording_32khz": "MARS_20260412_122000_resampled_32kHz.wav",
      "annotation_offset_s": 20.0,
      "frame_index": 4,
      "recording_start_utc_epoch": 1775996400,
      "label": 1,
      "label_type": "positive",
      "annotator": "duane",
      "month": "2026_04"
    },
    {
      "species": "other",
      "recording_32khz": "MARS_20260412_184000_resampled_32kHz.wav",
      "annotation_offset_s": 120.0,
      "frame_index": 24,
      "recording_start_utc_epoch": 1776019200,
      "label": 1,
      "label_type": "positive",
      "annotator": "duane",
      "month": "2026_04"
    },
    {
      "species": "other",
      "recording_32khz": "MARS_20260412_214000_resampled_32kHz.wav",
      "annotation_offset_s": 440.0,
      "frame_index": 88,
      "recording_start_utc_epoch": 1776030000,
      "label": 1,
      "label_type": "positive",
      "annotator": "duane",
      "month": "2026_04"
    },
    {
      "species": "other",
      "recording_32khz": "MARS_20260412_225000_resampled_32kHz.wav",
      "annotation_offset_s": 520.0,
      "frame_index": 104,
      "recording_start_utc_epoch": 1776034200,
      "label": 1,
      "label_type": "positive",
      "annotator": "duane",
      "month": "2026_04"
    },
    {
      "species": "other",
      "recording_32khz": "MARS_20260414_130000_resampled_32kHz.wav",
      "annotation_offset_s": 0.0,
      "frame_index": 0,
      "recording_start_utc_epoch": 1776171600,
      "label": 1,
      "label_type": "positive",
      "annotator": "duane",
      "month": "2026_04"
    },
    {
      "species": "other",
      "recording_32khz": "MARS_20260416_021000_resampled_32kHz.wav",
      "annotation_offset_s": 515.0,
      "frame_index": 103,
      "recording_start_utc_epoch": 1776305400,
      "label": 1,
      "label_type": "positive",
      "annotator": "duane",
      "month": "2026_04"
    },
    {
      "species": "other",
      "recording_32khz": "MARS_20260416_070000_resampled_32kHz.wav",
      "annotation_offset_s": 15.0,
      "frame_index": 3,
      "recording_start_utc_epoch": 1776322800,
      "label": 1,
      "label_type": "positive",
      "annotator": "duane",
      "month": "2026_04"
    },
    {
      "species": "other",
      "recording_32khz": "MARS_20260420_172000_resampled_32kHz.wav",
      "annotation_offset_s": 405.0,
      "frame_index": 81,
      "recording_start_utc_epoch": 1776705600,
      "label": 1,
      "label_type": "positive",
      "annotator": "duane",
      "month": "2026_04"
    },
    {
      "species": "other",
      "recording_32khz": "MARS_20260421_233000_resampled_32kHz.wav",
      "annotation_offset_s": 520.0,
      "frame_index": 104,
      "recording_start_utc_epoch": 1776814200,
      "label": 1,
      "label_type": "positive",
      "annotator": "duane",
      "month": "2026_04"
    },
    {
      "species": "other",
      "recording_32khz": "MARS_20260422_080000_resampled_32kHz.wav",
      "annotation_offset_s": 190.0,
      "frame_index": 38,
      "recording_start_utc_epoch": 1776844800,
      "label": 1,
      "label_type": "positive",
      "annotator": "duane",
      "month": "2026_04"
    },
    {
      "species": "other",
      "recording_32khz": "MARS_20260424_103000_resampled_32kHz.wav",
      "annotation_offset_s": 365.0,
      "frame_index": 73,
      "recording_start_utc_epoch": 1777026600,
      "label": 1,
      "label_type": "positive",
      "annotator": "duane",
      "month": "2026_04"
    },
    {
      "species": "other",
      "recording_32khz": "MARS_20260424_145000_resampled_32kHz.wav",
      "annotation_offset_s": 525.0,
      "frame_index": 105,
      "recording_start_utc_epoch": 1777042200,
      "label": 1,
      "label_type": "positive",
      "annotator": "duane",
      "month": "2026_04"
    },
    {
      "species": "other",
      "recording_32khz": "MARS_20260424_170000_resampled_32kHz.wav",
      "annotation_offset_s": 250.0,
      "frame_index": 50,
      "recording_start_utc_epoch": 1777050000,
      "label": 1,
      "label_type": "positive",
      "annotator": "duane",
      "month": "2026_04"
    },
    {
      "species": "other",
      "recording_32khz": "MARS_20260424_224000_resampled_32kHz.wav",
      "annotation_offset_s": 415.0,
      "frame_index": 83,
      "recording_start_utc_epoch": 1777070400,
      "label": 1,
      "label_type": "positive",
      "annotator": "duane",
      "month": "2026_04"
    },
    {
      "species": "other",
      "recording_32khz": "MARS_20260425_124000_resampled_32kHz.wav",
      "annotation_offset_s": 275.0,
      "frame_index": 55,
      "recording_start_utc_epoch": 1777120800,
      "label": 1,
      "label_type": "positive",
      "annotator": "duane",
      "month": "2026_04"
    },
    {
      "species": "other",
      "recording_32khz": "MARS_20260425_223000_resampled_32kHz.wav",
      "annotation_offset_s": 245.0,
      "frame_index": 49,
      "recording_start_utc_epoch": 1777156200,
      "label": 1,
      "label_type": "positive",
      "annotator": "duane",
      "month": "2026_04"
    },
    {
      "species": "other",
      "recording_32khz": "MARS_20260427_231000_resampled_32kHz.wav",
      "annotation_offset_s": 215.0,
      "frame_index": 43,
      "recording_start_utc_epoch": 1777331400,
      "label": 1,
      "label_type": "positive",
      "annotator": "duane",
      "month": "2026_04"
    },
    {
      "species": "other",
      "recording_32khz": "MARS_20260428_204000_resampled_32kHz.wav",
      "annotation_offset_s": 580.0,
      "frame_index": 116,
      "recording_start_utc_epoch": 1777408800,
      "label": 1,
      "label_type": "positive",
      "annotator": "duane",
      "month": "2026_04"
    },
    {
      "species": "other",
      "recording_32khz": "MARS_20260430_085000_resampled_32kHz.wav",
      "annotation_offset_s": 215.0,
      "frame_index": 43,
      "recording_start_utc_epoch": 1777539000,
      "label": 1,
      "label_type": "positive",
      "annotator": "duane",
      "month": "2026_04"
    }
  ]
}
